{
  "$schema": "https://json-schema.org/draft/2020-12/schema",
  "$id": "https://plat5.com/schema/config.json",
  "title": "Config",
  "description": "The whole config, as the CLI sends it and the control plane stores it: plat5.yml's keys, with services as a map of service name to service.",
  "type": "object",
  "additionalProperties": false,
  "required": ["kinds", "roles", "creator_role", "rate_limits"],
  "properties": {
    "deletion_grace": { "$ref": "settings.json#/properties/deletion_grace" },
    "reserved_slugs": { "$ref": "settings.json#/properties/reserved_slugs" },
    "users": { "$ref": "settings.json#/properties/users" },
    "route_checks": { "$ref": "settings.json#/properties/route_checks" },
    "defaults": { "$ref": "settings.json#/properties/defaults" },
    "kinds": { "$ref": "kinds.json#/properties/kinds" },
    "roles": { "$ref": "roles.json#/properties/roles" },
    "creator_role": { "$ref": "roles.json#/properties/creator_role" },
    "rate_limits": { "$ref": "rate_limits.json#/properties/rate_limits" },
    "cors": { "$ref": "cors.json#/properties/cors" },
    "services": {
      "title": "services",
      "description": "Map of service name → service.",
      "type": "object",
      "propertyNames": { "$ref": "services.json#/$defs/service_name" },
      "properties": {
        "identity": { "$ref": "services.json#/$defs/identity" },
        "audit": { "$ref": "services.json#/$defs/audit" }
      },
      "additionalProperties": { "$ref": "services.json#/$defs/service" }
    }
  }
}
